"conversation_id_str","created_at","favorite_count","full_text","id_str","image_url","in_reply_to_screen_name","lang","location","quote_count","reply_count","retweet_count","tweet_url","user_id_str","username"
"1808000427834933264","Tue Jul 02 06:09:04 +0000 2024","0","@momwholifts wkwkwkw.. kalo ini sih no comment ya.. ongkir beda 1000 aja diperhitungkan bngt emang kalo buyer.. bahkan kadang sampe kalo kena ongkir gajadi beli kebayang kl 5 taun lagi ecommerce udah ga bs support lagi tuh gratis ongkir kita balik ke taun 90 an deh..","1808020042648543457","","momwholifts","in","Bali, Indonesia","0","0","0","https://x.com/idthreedots/status/1808020042648543457","300750176","idthreedots"
"1807989753511662017","Tue Jul 02 05:25:27 +0000 2024","0","@glatft gapernah beli elektro via ecommerce akwowk kecuali kipas portable","1808009068277387392","","glatft","in","sby","0","0","0","https://x.com/sluttierrxbow/status/1808009068277387392","215464565","sluttierrxbow"
"1808007694583841040","Tue Jul 02 05:20:00 +0000 2024","0","Selain pinjam uang. kamu juga bisa belanja online dengan cicilan ringan di berbagai e commerce. makanya apk ini sempet trending banget di akhir 2022 karena mulai banyak peminatnya. https://t.co/HDEJSuBI5S","1808007694583841040","","","in","","0","0","0","https://x.com/Pengendiemaja/status/1808007694583841040","1463817937270173699","Pengendiemaja"
"1807994486720717271","Tue Jul 02 04:40:59 +0000 2024","0","@alunalunnganjuk di GO atau fanbase nya ndem menyelam aja biasanya kalo ada merch keluar pada buka GO tapi kalo bisa yg CO nya lewat ecommerce biar ga ketipu","1807997878943486140","","alunalunnganjuk","in","","0","1","0","https://x.com/Vanilalatte29/status/1807997878943486140","920594641","Vanilalatte29"
"1807993040382091636","Tue Jul 02 04:29:59 +0000 2024","1","@AleamsBarra namanya apa ya pak kalau kertas buram yang beneran buram itu mau beli di ecommerce aja di sini di toko-toko ga nemu","1807995106672496900","","AleamsBarra","in","Singapore","0","1","0","https://x.com/ainunnajib/status/1807995106672496900","35167068","ainunnajib"
"1807985210942017682","Tue Jul 02 03:50:39 +0000 2024","0","patut aku pump duit ini dalam biz kawan aku semalam dia cakap tidak ready ada probs dengan supplier. masalah dia aku dah bawak duit ni keluar terpaksa park dekat fd. anyone ada good business idea especially in beauty healthcare ecommerce boleh dm your pitch. aku nak invest https://t.co/YXdKf7ciWf","1807985210942017682","https://pbs.twimg.com/media/GRdA0G2aYAU4LUU.jpg","","in","Bukit Tunku","0","0","0","https://x.com/zukerbot/status/1807985210942017682","777473627226726401","zukerbot"
"1807975148903145789","Tue Jul 02 03:10:40 +0000 2024","0","chargeback kartu debit yang bertransaksi di e commerce butuh waktu berapa bulan??? @BANKBRI_ID","1807975148903145789","","","in","","1","4","0","https://x.com/jarbobb/status/1807975148903145789","1273046269577932801","jarbobb"
"1807971345310888416","Tue Jul 02 02:55:36 +0000 2024","0","DEAR ME BEAUTY Cleansing Balmnya bagus banget apalagi variant unguuu. harga anjlok bangett lebih murah daripada ecommerce Velvel liptintnya gak kalah murah uyyyy https://t.co/aQBmzzJkIj","1807971358229647855","https://pbs.twimg.com/media/GRc0XRfbcAAkp17.jpg","growlikng","in","she/her","0","1","0","https://x.com/growlikng/status/1807971358229647855","820562400034160640","growlikng"
"1807968620976525642","Tue Jul 02 02:44:44 +0000 2024","0","WKWKWKSSKKSKWKWKWKWK kalo belom tidur emang paling serem buka sosmed sama ecommerce ","1807968620976525642","","","in","","0","0","0","https://x.com/jaunechan/status/1807968620976525642","1061817945112829952","jaunechan"
"1807961545894515151","Tue Jul 02 02:26:52 +0000 2024","0","kerjanya apa? Digital Marketing (ads) ngerangkap &gt; teknikal accounting admin analisis data laporan optimasi cp dari funnel TOFU-MOFU-BOFU + jangan lupa Ads di Ecommerce/Google/Meta &gt;&gt;+ laporannya Social Media + live shopee. Menyala punggungku️‍️‍️‍️‍","1807964124737163274","","callmenaa1621","in","","0","1","0","https://x.com/callmenaa1621/status/1807964124737163274","1704759319076691968","callmenaa1621"
"1807794585852424488","Tue Jul 02 02:17:55 +0000 2024","0","@garudadidada10 Pandemi merangsang pertumbuhan bisnis e commerce dengan semakin banyaknya pelaku usaha yang merambah online #KedaulatanPangan","1807961872647573856","","garudadidada10","in","","0","0","0","https://x.com/TTitanimana/status/1807961872647573856","1751854584279261184","TTitanimana"
"1807960779385368742","Tue Jul 02 02:13:40 +0000 2024","0","POV lainnya selain ngebangun portofolio juga untuk ningkatin product knowledge 6 bulan gak bakal cukup untuk lu dapetin knowledge soal pasar dari field product yang lu pegang; knowldge soal ecommerce pasti bakal beda sama SaaS beda lagi sama OTT","1807960803418820966","","abdillah_evan","in","Jakarta Capital Region, Indone","0","1","0","https://x.com/abdillah_evan/status/1807960803418820966","950017146838433792","abdillah_evan"
"1807952257583046710","Tue Jul 02 01:39:42 +0000 2024","0","LOKER JOGJA TERBARU: CS Return Refund E Commerce di PT. Vads Indonesia #lokerjogja #lowongankerjajogja #loker #jogja #yogyakarta https://t.co/j7N6JGXZO6","1807952257583046710","","","in","Yogyakarta, Indonesia","0","0","0","https://x.com/lokerjog/status/1807952257583046710","575171760","lokerjog"
"1807951386585211096","Tue Jul 02 01:36:15 +0000 2024","0","Mengenal Asymmetric Encryption: Keamanan Data Tingkat Tinggi dengan Golang https://t.co/tmkrhUPid2 #business #ecommerce #html","1807951386585211096","","","in","Islamabad, Pakistan","0","0","0","https://x.com/BilalTariq01/status/1807951386585211096","4097639067","BilalTariq01"
"1807948264408506635","Tue Jul 02 01:27:53 +0000 2024","0","Akhirnya batal bjir. Dibatalin shopee padahal udah bayar (: Fix kemarin salah harga sih wkwk orang ecommerce lain masih harga normal. Keknya emang kudu percaya sama hasil spin wheel ","1807949282265518572","","Siapahayoue","in","","0","1","0","https://x.com/Siapahayoue/status/1807949282265518572","1124689415031246849","Siapahayoue"
"1807921459790229808","Mon Jul 01 23:52:22 +0000 2024","0","@Ecommerce_trw MasterPo","1807925245451399439","","Ecommerce_trw","in","","0","0","0","https://x.com/Breezyblock12/status/1807925245451399439","1457190167157035009","Breezyblock12"
"1807684376651849831","Mon Jul 01 07:55:15 +0000 2024","0","Ini loh gemay sekali tapi ngga pernah liat wujudnya di e commerce https://t.co/wOJxoUwlge","1807684376651849831","https://pbs.twimg.com/media/GRYvXDcawAAlRUF.jpg","","in","Central Java, Indonesia","0","0","0","https://x.com/AR_e_MIN_e/status/1807684376651849831","1313754524176142337","AR_e_MIN_e"
"1807676518862307561","Mon Jul 01 07:24:01 +0000 2024","0","Segabut gabut nya aku paling buka ig twitter e commerce sampai berbusa gak ada sampai kepikiran ngechat cwok","1807676518862307561","","","in","","0","0","0","https://x.com/Dea_DFA/status/1807676518862307561","247702697","Dea_DFA"
"1807653314806612217","Mon Jul 01 07:23:34 +0000 2024","1","@ninii_bearrr buatt belanja di alfa/indomaret bs ka tiff top up nya jg via e commerce","1807676406589243899","","ninii_bearrr","in","","0","0","0","https://x.com/parkRchaeyoung/status/1807676406589243899","1536373925189668866","parkRchaeyoung"
"1807658415835218419","Mon Jul 01 06:12:05 +0000 2024","0","Awalnya: Lari kan olah raga yang murah Mulai lari --&gt; naksir sepatu yang dipake orang --&gt;mulai nyari di e-commerce--&gt; ternyata harganya 2 jutaan. Lari jadi olahraga mahal.","1807658415835218419","","","in","Tokyo, Seoul, London, New York","0","1","0","https://x.com/colaVINsky/status/1807658415835218419","51353124","colaVINsky"
"1807645306772701239","Mon Jul 01 05:20:00 +0000 2024","0","Selain pinjam uang. kamu juga bisa belanja online dengan cicilan ringan di berbagai e commerce. makanya apk ini sempet trending banget di akhir 2022 karena mulai banyak peminatnya. https://t.co/HDEJSuBI5S","1807645306772701239","","","in","","0","0","0","https://x.com/Pengendiemaja/status/1807645306772701239","1463817937270173699","Pengendiemaja"
"1807319174102000040","Mon Jul 01 05:18:26 +0000 2024","0","@sushitrashissue coba nyelem karosel/ecommerce/wts. biasanya kalo gt itu ada yg jual tiba2","1807644911707254824","","sushitrashissue","in","","0","1","0","https://x.com/stillais/status/1807644911707254824","1355378590016135172","stillais"
"1807631879178535160","Mon Jul 01 04:26:38 +0000 2024","0","min @JNECare paket saya di tracker dan app ecommerce sudah ada di gerai arena dekat saya samperin ternyata paket tidak ada. mohon di bantu","1807631879178535160","","","in","INDONESIA","1","2","0","https://x.com/gorenganbiji/status/1807631879178535160","1516133114472374275","gorenganbiji"
"1807594886335717854","Mon Jul 01 01:59:39 +0000 2024","0","Jadi gini rasanya nyesel gabeli barang pameran bcs harga di e commerce jadi 2kali lipat aaa ","1807594886335717854","","","in","","0","1","0","https://x.com/arvrisa/status/1807594886335717854","1712281938764107776","arvrisa"
"1807585473264853375","Mon Jul 01 01:22:14 +0000 2024","0","Cara paling mudah nak buat website Sneakers dalam 1 hari! Login ke https://t.co/r8pzyQnvrI dan setup website Sneakers anda hari ini. Khas untuk Founder Bisnes Fashion Sneakers! #shoppegram #shoppegramsenang #terangiacademy #ecommerce https://t.co/6J6lEUSwXL","1807585473264853375","https://pbs.twimg.com/ext_tw_video_thumb/1807585313285644288/pu/img/N9S0rCyg-gu7VaQo.jpg","","in","","0","0","0","https://x.com/terangiacademy/status/1807585473264853375","1627553506931666946","terangiacademy"
"1807583735820534054","Mon Jul 01 01:15:20 +0000 2024","0","Cara paling mudah nak buat website Sneakers dalam 1 hari! Login ke https://t.co/yZbOEKu4ml dan setup website Sneakers anda hari ini. Khas untuk Founder Bisnes Fashion Sneakers! #shoppegram #shoppegramsenang #terangiacademy #ecommerce https://t.co/xoNtuC24de","1807583735820534054","https://pbs.twimg.com/ext_tw_video_thumb/1807583573106683904/pu/img/I2TN-z8d1sTZP-Ls.jpg","","in","Cyberjaya Selangor","0","0","0","https://x.com/shoppegram/status/1807583735820534054","1078818445","shoppegram"
"1807581788463911122","Mon Jul 01 01:07:36 +0000 2024","0","Cara paling mudah nak buat website Kasut Sukan dalam 1 hari! Login ke https://t.co/r8pzyQnvrI dan setup website Kasut Sukan anda hari ini. Khas untuk Founder Bisnes Fashion Kasut Sukan! #shoppegram #shoppegramsenang #terangiacademy #ecommerce https://t.co/yRxUhuS2FO","1807581788463911122","https://pbs.twimg.com/ext_tw_video_thumb/1807581687943172096/pu/img/CCIAMtDxEa1vg_bM.jpg","","in","","0","0","0","https://x.com/terangiacademy/status/1807581788463911122","1627553506931666946","terangiacademy"
"1807580711895040397","Mon Jul 01 01:03:19 +0000 2024","0","Cara paling mudah nak buat website Kasut Sukan dalam 1 hari! Login ke https://t.co/yZbOEKu4ml dan setup website Kasut Sukan anda hari ini. Khas untuk Founder Bisnes Fashion Kasut Sukan! #shoppegram #shoppegramsenang #terangiacademy #ecommerce https://t.co/81vVECgfJ3","1807580711895040397","https://pbs.twimg.com/ext_tw_video_thumb/1807580586288271360/pu/img/9sPJXxoePz6tbein.jpg","","in","Cyberjaya Selangor","0","0","0","https://x.com/shoppegram/status/1807580711895040397","1078818445","shoppegram"
"1807467923986145598","Sun Jun 30 17:40:16 +0000 2024","0","@quwiyn iya lagiii! mikirin snack sticker dll wkwkwk coba semua seller di ecommerce ada freebies2 an ya pasti seru","1807469212740604413","","quwiyn","in","she/her","0","0","0","https://x.com/craxzsh/status/1807469212740604413","1494361694927085608","craxzsh"
"1807114315343995088","Sat Jun 29 18:10:01 +0000 2024","2","Jam 1 malem tiba tiba beli mesin cuci. Emang kalo lagi bad mood itu baiknya tidur sih bukan buka e commerce ","1807114315343995088","","","in","","0","1","0","https://x.com/bbananalicious/status/1807114315343995088","481217600","bbananalicious"
"1807091060356808770","Sat Jun 29 16:37:37 +0000 2024","134","Guys kalian yg suka beli per-sambal-an di ecommerce saranin sambel yg beneran enak dong alias ga cuma viral doang? Gue pernah beli yang eats*mbel menurut gue sambelnya b aja gada yg istimewa. Kerasa bgt sambel kemasannya gitu loh ngerti gak Pengen yg beneran endul","1807091060356808770","","","in","Jakarta Selatan, DKI Jakarta","1","24","8","https://x.com/lilaccountz/status/1807091060356808770","1110589789584015360","lilaccountz"
"1807088473796665581","Sat Jun 29 16:27:20 +0000 2024","0","chargeback kartu debit yang bertransaksi di e commerce butuh waktu berapa bulan??? @BANKBRI_ID","1807088473796665581","","","in","","1","3","0","https://x.com/jarbobb/status/1807088473796665581","1273046269577932801","jarbobb"
"1807070739968712876","Sat Jun 29 15:16:52 +0000 2024","1","LegendaryArt https://t.co/F6wh1XyZMC #ecommerce","1807070739968712876","","","in","","0","0","0","https://x.com/Legendaryartai/status/1807070739968712876","1757108436485992448","Legendaryartai"
"1807069276672790559","Sat Jun 29 15:11:03 +0000 2024","0","Tren Penjualan Tabir Surya di Ecommerce di Kuartal 1 2024 Azarine Mendominasi Penjualan https://t.co/n5xhNaeRIS","1807069276672790559","","","in","Indragiri Hilir, Riau","0","0","0","https://x.com/Defrian38829563/status/1807069276672790559","793475347086016514","Defrian38829563"
"1806933177958842728","Sat Jun 29 13:58:02 +0000 2024","3","@pattahu @txtfromIR jelek itu apps mahal2. masih menang ecommerce lokal","1807050897870172625","","pattahu","in","Indonesia","0","0","0","https://x.com/ditjenpalak/status/1807050897870172625","33862321","ditjenpalak"
"1806706679867965717","Sat Jun 29 13:20:46 +0000 2024","0","@xihuanese @worksfess ohh tau ini kak emang e commerce ada yg ga ngotak jam kerjanya semangat kak ","1807041519657844844","","xihuanese","in","","0","1","0","https://x.com/labellelafou/status/1807041519657844844","1503946341528981505","labellelafou"
"1807028955058409875","Sat Jun 29 12:30:50 +0000 2024","0","Percuma hapus hapus data di kantongan ecommerce orang datanya sudah dijual di dark web","1807028955058409875","","","in","she/her","0","1","0","https://x.com/hellorenjun23/status/1807028955058409875","435757686","hellorenjun23"
"1807011587389292733","Sat Jun 29 11:24:09 +0000 2024","0","dampak jumlah pinjol ke reansaki ecommerce dan yg mati siapa?!?!?!?!?!","1807012173954310391","","vaurmillions","in","","0","0","0","https://x.com/vaurmillions/status/1807012173954310391","1423323694026264576","vaurmillions"
"1807002105280106628","Sat Jun 29 10:44:09 +0000 2024","1","Beli barang d official web dapet diskon sih tp ternyata blm termasuk ppn 11%. Besok2 beli d e commerce lg aja dah","1807002105280106628","","","in","Paradise Falls","0","0","0","https://x.com/heyndrikkk/status/1807002105280106628","261616062","heyndrikkk"
"1806668705893699929","Sat Jun 29 10:37:36 +0000 2024","0","@drake_bn kalau face soap sekaligus body soap bisa pakai kojic san. Beli di official store di e commerce'. Sunscreen ga butuh² amat kalau tone kulit berwarna dan ga terkena terik langsung. Kalau sering di AC wajib minum cukup air putih","1807000458105630847","","drake_bn","in","","0","1","0","https://x.com/danieserl/status/1807000458105630847","1503421498911952898","danieserl"
"1806706679867965717","Sat Jun 29 10:14:05 +0000 2024","0","@labellelafou @worksfess E commerce tapi gaji sama jam kerja ga sesuai","1806994540706013530","","labellelafou","in","🔴 for 威神V • she/her ","0","1","0","https://x.com/xihuanese/status/1806994540706013530","1362674044152074242","xihuanese"
"1806916954374156451","Sat Jun 29 09:39:33 +0000 2024","0","@cachabiya kadang tokonya kalo dicari di e commerce juga ha ada","1806985849785229613","","broukolii","in","Malang","0","1","0","https://x.com/broukolii/status/1806985849785229613","2188030819","broukolii"
"1806973179359052270","Sat Jun 29 08:51:51 +0000 2024","0","gabisa co oren atau pun e commerce lain yaw manual only. cuz kalau mau di paksa co lewat e commerce nnti kena bayar cukai 19%","1806973844504359392","","axxpxxbxx","in","Indonesia","0","0","0","https://x.com/axxpxxbxx/status/1806973844504359392","1114790163601743872","axxpxxbxx"
"1806963541955469611","Sat Jun 29 08:10:55 +0000 2024","0","kan aku jd takut bgt masalahnya aku gaada mesen di ecommerce manapun dan kalau cust aku kirim biasanya confirm buat diexport. ini gaada samsek udh 3 hari ini anjir serem bgt sumpah","1806963545965486398","","lilnanaaas","in","Kota Surabaya, Jawa Timur","0","0","0","https://x.com/lilnanaaas/status/1806963545965486398","1410048006196326407","lilnanaaas"
"1806961191652299029","Sat Jun 29 08:01:34 +0000 2024","0","Scam ramayana balet prambanan. Mereka pakai ktp dan tiket atas nama shinta wahyuni dengan domisili boyolali. Hati semua. Better langsung beli di admin whatsapp kalau di ecommerce habis. https://t.co/7vjpc85zzF","1806961191652299029","https://pbs.twimg.com/media/GROdngubYAAFkla.jpg","","in","Yogyakarta, Indonesia","0","0","0","https://x.com/jillinoish/status/1806961191652299029","1223514591050616833","jillinoish"
"1806960091209548050","Sat Jun 29 07:57:12 +0000 2024","107","Guys bantu pilihin dong buat ke resepsi ade nanti... Karna temanya internasyenel Ga pake batik ya. Kira2 yg cocok yg mana? Atau kalian ada ide dan rekomen ecommerce yg jual gaun kasual yg gak ribet karna aku pasti akan jadi si paling sok sibuk yakan nanti. https://t.co/TDTZuXafkU","1806960091209548050","https://pbs.twimg.com/media/GROcn2GaMAA-yB2.jpg","","in","Jakarta Timur, DKI Jakarta","0","21","0","https://x.com/its_Rasidah/status/1806960091209548050","2922380976","its_Rasidah"
"1806721049402515747","Sat Jun 29 06:37:19 +0000 2024","4","@SelebtwitFess Paling males kalau udah pada bilang 'Toyota aja sama daihatsu spare part Suzuki tuh susah' Ambil aja Baleno mbak. Jaringan service Suzuki juga ga kalah luas. Spare part juga e commerce sekarang mempermudah pencarian.","1806939988816474386","","SelebtwitFess","in","Kota Batam, Kepulauan Riau","0","2","0","https://x.com/unggul_anggoro/status/1806939988816474386","159100605","unggul_anggoro"
"1806939316851015964","Sat Jun 29 06:34:39 +0000 2024","6","work! lg trial kerja socmed specialist tp ngerjain e commerce jg rekap sampe bungkus paket. menurut kalian lanjut ngga ya?","1806939316851015964","","","in","MENFESS SEMI-OTOMATIS","1","9","0","https://x.com/worksfess/status/1806939316851015964","1244597361826885636","worksfess"
"1806930602140291515","Sat Jun 29 06:00:01 +0000 2024","5","Hobi scroll di ecommerce dan pengen dapet tambahan cuan? Gabung affiliate Telkomsel aja Tinggal share link Kartu Perdana Telkomsel yang dijual di Shopee atau Tokopedia ke rekan sampai keluargamu &amp; dapetin komisi tambahan hingga 10%! Info: https://t.co/1IDh2d7NLZ *S&amp;K berlaku https://t.co/RONC5pNgyT","1806930602140291515","https://pbs.twimg.com/ext_tw_video_thumb/1806920068053553153/pu/img/O2GRkHh6NSxTno1z.jpg","","in","Indonesia","0","1","1","https://x.com/Telkomsel/status/1806930602140291515","255409050","Telkomsel"
"1806688452945362989","Sat Jun 29 05:45:35 +0000 2024","0","@clouvesh Aku cuma modal nyocokkin serial number yg ada di size tag ajaa ke google ‍ jadi kl sr no nya juga dibajak yaudah pasrah WKWK paling gampang emang cari seller yg recommended di ig/twt biasanya pada punya akun ecommerce juga buat jualnyaa biar aman hahah","1806926970317660434","","clouvesh","in","HMSON JSLEE MOTOGP EXO","0","0","0","https://x.com/cxrxlxxnblue/status/1806926970317660434","1320379851044315137","cxrxlxxnblue"
"1806913256914817207","Sat Jun 29 04:55:49 +0000 2024","0","@akunyakul asli bu sehari sampe ga nyampe 24jam pokonyaa dari dulu aku emang lebih sering milih belanja di sini mana harganya jg jauh lebih murah. sygnya emg belom selengkap ecommerce lain","1806914444964098314","","akunyakul","in","","0","1","0","https://x.com/66haechanahceah/status/1806914444964098314","1215596286046457856","66haechanahceah"
"1806908755336106496","Sat Jun 29 04:33:12 +0000 2024","0","Hari gini ada org transaksi di luar ecommerce aja udh aneh","1806908755336106496","","","in","","0","0","0","https://x.com/hiddengloomy/status/1806908755336106496","1487081147670532105","hiddengloomy"
"1806561542655328585","Sat Jun 29 03:42:27 +0000 2024","0","@vishalm1985 @ThetaVegaCap Jio reason nahi hai anpadh.... Scams and high competition hai... Agar jio hi reason hota...to wo Jin bhi business me hai waha sabme monopoly kyo nahi bana raha?? Thoda padha likha karo dhang se..free to ecommerce ne bhi bohot dia kitne monopoly bangaye?? Jio mart? BB? Blinkit?","1806895982153806071","","vishalm1985","in","","0","0","0","https://x.com/_Sun_Tzu__/status/1806895982153806071","1750394976503230464","_Sun_Tzu__"
"1806863948135944444","Sat Jun 29 01:35:09 +0000 2024","0","Kebangun jam 2 pagi ngecek2 timbangan kopi di ecommerce","1806863948135944444","","","in","","0","0","0","https://x.com/VitalongC1234/status/1806863948135944444","1355512119270105092","VitalongC1234"
"1806536264633786575","Fri Jun 28 21:21:01 +0000 2024","0","@0xsatyaa akibat diserbu barang murah cina di ecommerce warganya ga naik kelas malah turun kelas apa-apa harus serba murah. jd pengusaha lokal harus banting harga banting kualitas sing penting cuan.","1806799991345971392","","0xsatyaa","in","","0","0","0","https://x.com/arkassssabbiqe/status/1806799991345971392","1744056207084777472","arkassssabbiqe"
"1806763381908758632","Fri Jun 28 18:58:33 +0000 2024","0","@almoandd HAHAHAH AKU BOROSSS JD KADANG MAMA AKU MASIH SUKA NGECEK PENGELUARAN AKU DARI ECOMMERCE APA AJAA","1806764137281982531","","almoandd","in","bisexual | 23 | mdni","0","1","0","https://x.com/fffreyza/status/1806764137281982531","1755984633471401984","fffreyza"
"1806763381908758632","Fri Jun 28 18:55:32 +0000 2024","2","pengen beli sex toys tp takut soalnya history ecommerce aku masih sering dicek WKWKWK","1806763381908758632","","","in","bisexual | 23 | mdni","0","2","0","https://x.com/fffreyza/status/1806763381908758632","1755984633471401984","fffreyza"
"1806623896877269078","Fri Jun 28 10:22:39 +0000 2024","60","@anggamaf_ Jaman dulu masih seneng download² game lagu atau film saya bawa laptop ama modem sendiri. Jadi ga konek ama intranet kantor. Tapi ya terpaksa juga sih itu soalnya jaman itu internet kantor juga ga bisa buka sosmed or ecommerce","1806634308695707777","","anggamaf_","in","Jakarta Selatan, DKI Jakarta","0","1","2","https://x.com/madHink/status/1806634308695707777","3284232205","madHink"
"1806626286821126332","Fri Jun 28 09:50:46 +0000 2024","1","Cara paling mudah nak buat website Kasut Kulit dalam 1 hari! Login ke https://t.co/yZbOEKu4ml dan setup website Kasut Kulit anda hari ini. Khas untuk Founder Bisnes Fashion Kasut Kulit! #shoppegram #shoppegramsenang #terangiacademy #ecommerce https://t.co/fY42dyNfxG","1806626286821126332","https://pbs.twimg.com/ext_tw_video_thumb/1806626188888354816/pu/img/EpYaQNz15MkJNNH8.jpg","","in","Cyberjaya Selangor","0","0","0","https://x.com/shoppegram/status/1806626286821126332","1078818445","shoppegram"
"1806612517558624712","Fri Jun 28 09:10:08 +0000 2024","0","@pichidichi Awkwokwksk that ((digaji pake uang lembur beneran bukan sogokan makanan)) anak ahensi &amp; ecommerce tersedak melihat ini ","1806616057802867129","","pichidichi","in","","0","1","0","https://x.com/ditsprtw/status/1806616057802867129","1048784956426616832","ditsprtw"
"1806606921019035669","Fri Jun 28 08:52:56 +0000 2024","0","@StayToBeMelody Malah mantengin ecommerce bukannya siap siap pulang","1806611731625742725","","StayToBeMelody","in","Stayville","0","1","0","https://x.com/strongwolfie/status/1806611731625742725","1351005942406664193","strongwolfie"
"1806606921019035669","Fri Jun 28 08:49:47 +0000 2024","0","@strongwolfie Itulaaah ini 10 menit sekali aku cek ecommerce ","1806610936347742603","","strongwolfie","in","","0","1","0","https://x.com/StayToBeMelody/status/1806610936347742603","110347917","StayToBeMelody"
"1806598682189725790","Fri Jun 28 08:44:51 +0000 2024","0","@herrysw Info case sama TG om? Susah bgt cari di ecommerce","1806609698436829465","","herrysw","in","Kota Malang, Jawa Timur","0","1","0","https://x.com/lunatixdreamer/status/1806609698436829465","124641614","lunatixdreamer"
"1806592648280490191","Fri Jun 28 07:37:06 +0000 2024","0"," Men For San Champu Anti-insectos Para Gato 300ml - 7.86 EUR€ #madalishop #ofertas #ecommerce #enviogratis #belleza #hogar #tecnologia #regalos #menforsan https://t.co/aZoreAzq7y","1806592648280490191","","","in","España","0","0","0","https://x.com/madali_shop/status/1806592648280490191","1630558004427870208","madali_shop"
"1806592420370374666","Fri Jun 28 07:36:12 +0000 2024","0"," Bomba sup. aguas limpias 800w-3200 l/h - 156.12 EUR€ #madalishop #ofertas #ecommerce #enviogratis #belleza #hogar #tecnologia #regalos #alfagreen https://t.co/uvVXM1QkXt","1806592420370374666","","","in","España","0","0","0","https://x.com/madali_shop/status/1806592420370374666","1630558004427870208","madali_shop"
"1806592388426609063","Fri Jun 28 07:36:04 +0000 2024","0"," Cepillo limpia-bujias puas laton - 1.50 EUR€ #madalishop #ofertas #ecommerce #enviogratis #belleza #hogar #tecnologia #regalos #stein https://t.co/fnZgFo1KGU","1806592388426609063","","","in","España","0","0","0","https://x.com/madali_shop/status/1806592388426609063","1630558004427870208","madali_shop"
"1806584220841840726","Fri Jun 28 07:03:45 +0000 2024","0","Yuyur sejak saat itu aku kalo beli barang yang kurasa mahal dan gak bisa di ecommerce.. terpaksa banget aku pakai akun IGku yang followernya banyak. Soalnya resiko tertipunya agak lebih rendah dibanding aku pakai second acc.","1806584254127874231","","Onychristy_","in","Indonesia","0","0","0","https://x.com/Onychristy_/status/1806584254127874231","411969606","Onychristy_"
