cid;comment;reply_cid;reply_id;reply_text
7378390184944337670;mudahn lncar;7378765064659796753;7378390184944337670;terima kasih dukungannya ya kak. -AS
7376882257975935749;telat byr langsung nmr hp disebar;7376918405352719120;7376882257975935749;Mohon maaf atas ketidakyamannya, kakak tidak perlu khawatir, terkait kendalanya kakak bisa di informasikan ke inbox kami ya.
-AS
7376882257975935749;telat byr langsung nmr hp disebar;7380548520976483078;7376882257975935749;kontak157.ojk.go.id, telepon 157, WhatsApp di nomor 081157157157, dan email konsumen@ojk.go.id.
7372176027496284933;mau tanya saya dah lunasi cicilan tp kok tiba" ada tagiran 1rb perak itu byr nya lwt apa soalnya gak ada plihan ewalet;7372462870343271169;7372176027496284933;Mohon maaf kak, terkait kendalanya bisa inbox kami ya kak. -AS
7372176027496284933;mau tanya saya dah lunasi cicilan tp kok tiba" ada tagiran 1rb perak itu byr nya lwt apa soalnya gak ada plihan ewalet;7379123328911819525;7372176027496284933;游때游때游때游때游때
